{
  "$schema": "https://json-schema.org/draft/2020-12/schema",
  "$id": "https://vera.example/schemas/founder-release-evidence-v2.json",
  "title": "Vera founder release evidence bundle",
  "description": "Closed, profile-bound evidence manifest. Synthetic instances are non-releasable and production validation rejects them.",
  "type": "object",
  "additionalProperties": false,
  "required": [
    "schemaVersion",
    "synthetic",
    "releaseProfile",
    "capabilities",
    "releaseId",
    "environmentId",
    "sourceCommit",
    "candidateWorkerImage",
    "candidateOpenclawImage",
    "createdAt",
    "records",
    "bundleHash"
  ],
  "properties": {
    "schemaVersion": {
      "const": 2
    },
    "synthetic": {
      "type": "boolean"
    },
    "releaseProfile": {
      "$ref": "#/$defs/releaseProfile"
    },
    "capabilities": {
      "$ref": "#/$defs/capabilities"
    },
    "releaseId": {
      "$ref": "#/$defs/safeId"
    },
    "environmentId": {
      "$ref": "#/$defs/safeId"
    },
    "sourceCommit": {
      "$ref": "#/$defs/gitCommit"
    },
    "candidateWorkerImage": {
      "$ref": "#/$defs/imageDigest"
    },
    "candidateOpenclawImage": {
      "oneOf": [
        {
          "type": "null"
        },
        {
          "$ref": "#/$defs/imageDigest"
        }
      ]
    },
    "createdAt": {
      "$ref": "#/$defs/instant"
    },
    "records": {
      "type": "array",
      "minItems": 1,
      "maxItems": 40,
      "items": {
        "$ref": "#/$defs/record"
      }
    },
    "bundleHash": {
      "$ref": "#/$defs/sha256"
    },
    "signature": {
      "$ref": "#/$defs/signature"
    }
  },
  "allOf": [
    {
      "if": {
        "properties": {
          "releaseProfile": {
            "const": "founder_core"
          }
        },
        "required": ["releaseProfile"]
      },
      "then": {
        "properties": {
          "capabilities": {
            "$ref": "#/$defs/coreCapabilities"
          },
          "candidateOpenclawImage": {
            "type": "null"
          }
        }
      },
      "else": {
        "properties": {
          "capabilities": {
            "$ref": "#/$defs/browserCapabilities"
          },
          "candidateOpenclawImage": {
            "$ref": "#/$defs/imageDigest"
          }
        }
      }
    }
  ],
  "$defs": {
    "releaseProfile": {
      "enum": ["founder_core", "founder_browser_experimental"]
    },
    "capabilities": {
      "type": "object",
      "additionalProperties": false,
      "required": [
        "browserCapture",
        "directCapture",
        "gmailAlerts",
        "calendar",
        "webPush",
        "maritimeWorker"
      ],
      "properties": {
        "browserCapture": {
          "type": "boolean"
        },
        "directCapture": {
          "const": true
        },
        "gmailAlerts": {
          "const": true
        },
        "calendar": {
          "const": true
        },
        "webPush": {
          "const": true
        },
        "maritimeWorker": {
          "const": true
        }
      }
    },
    "coreCapabilities": {
      "allOf": [
        {
          "$ref": "#/$defs/capabilities"
        },
        {
          "properties": {
            "browserCapture": {
              "const": false
            }
          }
        }
      ]
    },
    "browserCapabilities": {
      "allOf": [
        {
          "$ref": "#/$defs/capabilities"
        },
        {
          "properties": {
            "browserCapture": {
              "const": true
            }
          }
        }
      ]
    },
    "safeId": {
      "type": "string",
      "pattern": "^[A-Za-z0-9][A-Za-z0-9._-]{2,100}$"
    },
    "safeReference": {
      "type": "string",
      "pattern": "^[A-Za-z0-9][A-Za-z0-9._:/-]{2,255}$"
    },
    "safeResult": {
      "type": "string",
      "minLength": 3,
      "maxLength": 500,
      "pattern": "^[A-Za-z0-9][A-Za-z0-9 .,;:()_/-]+$"
    },
    "gitCommit": {
      "type": "string",
      "pattern": "^[a-f0-9]{40}$"
    },
    "instant": {
      "type": "string",
      "pattern": "^\\d{4}-\\d{2}-\\d{2}T\\d{2}:\\d{2}:\\d{2}(?:\\.\\d{1,9})?Z$"
    },
    "sha256": {
      "type": "string",
      "pattern": "^[a-f0-9]{64}$",
      "not": {
        "pattern": "^0{64}$"
      }
    },
    "imageDigest": {
      "type": "string",
      "pattern": "^[^\\s@]+@sha256:[a-f0-9]{64}$",
      "not": {
        "pattern": "@sha256:0{64}$"
      }
    },
    "phaseId": {
      "enum": [
        "release_static_readiness",
        "postgresql_snapshot_and_backup",
        "postgresql_restore",
        "migration_and_idempotent_bootstrap",
        "hosted_web_deployment",
        "maritime_worker_dispatch",
        "direct_capture",
        "duplicate_dispatch",
        "replayed_result",
        "worker_restart_recovery",
        "web_push_delivery",
        "web_push_deduplication",
        "quiet_hours",
        "provider_outage",
        "gmail_readonly_verification",
        "calendar_freebusy_and_approved_hold",
        "emergency_disable",
        "worker_image_rollback",
        "browser_global_kill_switch_enabled",
        "browser_founder_capability_disabled",
        "browser_source_jobs_rejected_before_dispatch",
        "browser_gateway_not_required",
        "browser_endpoint_not_exposed",
        "browser_monitoring_not_scheduled",
        "browser_activation_not_exposed",
        "remote_extension_image_and_config",
        "remote_extension_wss_upgrade",
        "remote_extension_subprotocol_preservation",
        "remote_extension_pairing_auth",
        "remote_extension_route_isolation",
        "remote_extension_connection_stability",
        "remote_extension_payload_and_timeouts",
        "remote_extension_security_audit",
        "remote_extension_deep_security_audit",
        "founder_positive_shared_tab_snapshot",
        "founder_noninteraction_enforcement",
        "remote_extension_revocation_and_shutdown"
      ]
    },
    "resultState": {
      "enum": [
        "passed_automated",
        "passed_manual_evidence",
        "blocked_missing_configuration",
        "failed_assertion",
        "failed_provider",
        "not_applicable_with_approved_reason"
      ]
    },
    "configurationBlocker": {
      "type": "object",
      "additionalProperties": false,
      "required": [
        "kind",
        "missingConfiguration",
        "remediation",
        "implementationState",
        "nonLiveValidationState",
        "requiresRepositoryChange",
        "requiresDesignDecision"
      ],
      "properties": {
        "kind": {
          "enum": [
            "external_staging_value",
            "external_credential",
            "external_deployment",
            "operator_execution"
          ]
        },
        "missingConfiguration": {
          "$ref": "#/$defs/safeId"
        },
        "remediation": {
          "$ref": "#/$defs/safeResult"
        },
        "implementationState": {
          "const": "implemented_and_validated"
        },
        "nonLiveValidationState": {
          "const": "passed"
        },
        "requiresRepositoryChange": {
          "const": false
        },
        "requiresDesignDecision": {
          "const": false
        }
      }
    },
    "evidenceReference": {
      "type": "object",
      "additionalProperties": false,
      "required": ["kind", "locator", "sha256"],
      "properties": {
        "kind": {
          "enum": [
            "github_actions_artifact",
            "managed_database_snapshot",
            "private_object",
            "sanitized_screenshot",
            "test_run",
            "workflow_run",
            "deployment_digest"
          ]
        },
        "locator": {
          "$ref": "#/$defs/safeReference"
        },
        "sha256": {
          "$ref": "#/$defs/sha256"
        }
      }
    },
    "record": {
      "type": "object",
      "additionalProperties": false,
      "required": [
        "schemaVersion",
        "synthetic",
        "releaseProfile",
        "capabilities",
        "phaseId",
        "releaseId",
        "environmentId",
        "sourceCommit",
        "candidateWorkerImage",
        "candidateOpenclawImage",
        "executedAt",
        "operatorReference",
        "expectedResult",
        "observedResult",
        "resultState",
        "configurationBlocker",
        "evidenceReferences",
        "approvalState",
        "contentHash"
      ],
      "properties": {
        "schemaVersion": {
          "const": 2
        },
        "synthetic": {
          "type": "boolean"
        },
        "releaseProfile": {
          "$ref": "#/$defs/releaseProfile"
        },
        "capabilities": {
          "$ref": "#/$defs/capabilities"
        },
        "phaseId": {
          "$ref": "#/$defs/phaseId"
        },
        "releaseId": {
          "$ref": "#/$defs/safeId"
        },
        "environmentId": {
          "$ref": "#/$defs/safeId"
        },
        "sourceCommit": {
          "$ref": "#/$defs/gitCommit"
        },
        "candidateWorkerImage": {
          "$ref": "#/$defs/imageDigest"
        },
        "candidateOpenclawImage": {
          "oneOf": [
            {
              "type": "null"
            },
            {
              "$ref": "#/$defs/imageDigest"
            }
          ]
        },
        "executedAt": {
          "$ref": "#/$defs/instant"
        },
        "operatorReference": {
          "$ref": "#/$defs/safeId"
        },
        "expectedResult": {
          "$ref": "#/$defs/safeResult"
        },
        "observedResult": {
          "$ref": "#/$defs/safeResult"
        },
        "resultState": {
          "$ref": "#/$defs/resultState"
        },
        "configurationBlocker": {
          "oneOf": [
            {
              "type": "null"
            },
            {
              "$ref": "#/$defs/configurationBlocker"
            }
          ]
        },
        "evidenceReferences": {
          "type": "array",
          "minItems": 1,
          "maxItems": 12,
          "items": {
            "$ref": "#/$defs/evidenceReference"
          }
        },
        "approvalState": {
          "const": "approved"
        },
        "contentHash": {
          "$ref": "#/$defs/sha256"
        }
      },
      "allOf": [
        {
          "if": {
            "properties": {
              "resultState": {
                "const": "blocked_missing_configuration"
              }
            },
            "required": ["resultState"]
          },
          "then": {
            "properties": {
              "configurationBlocker": {
                "$ref": "#/$defs/configurationBlocker"
              }
            }
          },
          "else": {
            "properties": {
              "configurationBlocker": {
                "type": "null"
              }
            }
          }
        },
        {
          "if": {
            "properties": {
              "releaseProfile": {
                "const": "founder_core"
              }
            },
            "required": ["releaseProfile"]
          },
          "then": {
            "properties": {
              "capabilities": {
                "$ref": "#/$defs/coreCapabilities"
              },
              "candidateOpenclawImage": {
                "type": "null"
              }
            }
          },
          "else": {
            "properties": {
              "capabilities": {
                "$ref": "#/$defs/browserCapabilities"
              },
              "candidateOpenclawImage": {
                "$ref": "#/$defs/imageDigest"
              }
            }
          }
        }
      ]
    },
    "signature": {
      "type": "object",
      "additionalProperties": false,
      "required": ["kind", "signerReference", "signedBundleHash", "value"],
      "properties": {
        "kind": {
          "enum": ["ci", "operator"]
        },
        "signerReference": {
          "$ref": "#/$defs/safeReference"
        },
        "signedBundleHash": {
          "$ref": "#/$defs/sha256"
        },
        "value": {
          "type": "string",
          "minLength": 16,
          "maxLength": 4096,
          "pattern": "^[A-Za-z0-9+/=_-]+$"
        }
      }
    }
  }
}
