{
  "schemaVersion": 2,
  "synthetic": true,
  "releaseProfile": "founder_core",
  "capabilities": {
    "browserCapture": false,
    "directCapture": true,
    "gmailAlerts": true,
    "calendar": true,
    "webPush": true,
    "maritimeWorker": true
  },
  "releaseId": "synthetic-release-002",
  "environmentId": "synthetic-staging",
  "sourceCommit": "bbbbbbbbbbbbbbbbbbbbbbbbbbbbbbbbbbbbbbbb",
  "candidateWorkerImage": "ghcr.io/example/vera-worker@sha256:2222222222222222222222222222222222222222222222222222222222222222",
  "candidateOpenclawImage": null,
  "createdAt": "2026-07-23T13:05:00Z",
  "records": [
    {
      "schemaVersion": 2,
      "synthetic": true,
      "releaseProfile": "founder_core",
      "capabilities": {
        "browserCapture": false,
        "directCapture": true,
        "gmailAlerts": true,
        "calendar": true,
        "webPush": true,
        "maritimeWorker": true
      },
      "phaseId": "postgresql_restore",
      "releaseId": "synthetic-release-002",
      "environmentId": "synthetic-staging",
      "sourceCommit": "bbbbbbbbbbbbbbbbbbbbbbbbbbbbbbbbbbbbbbbb",
      "candidateWorkerImage": "ghcr.io/example/vera-worker@sha256:2222222222222222222222222222222222222222222222222222222222222222",
      "candidateOpenclawImage": null,
      "executedAt": "2026-07-23T13:00:00Z",
      "operatorReference": "synthetic-operator-002",
      "expectedResult": "Synthetic restore rehearsal completes",
      "observedResult": "External staging restore execution remains pending",
      "resultState": "blocked_missing_configuration",
      "configurationBlocker": {
        "kind": "operator_execution",
        "missingConfiguration": "synthetic_restore_rehearsal",
        "remediation": "Run the documented restore rehearsal and attach its sanitized test run hash",
        "implementationState": "implemented_and_validated",
        "nonLiveValidationState": "passed",
        "requiresRepositoryChange": false,
        "requiresDesignDecision": false
      },
      "evidenceReferences": [
        {
          "kind": "test_run",
          "locator": "synthetic-run-restore",
          "sha256": "4444444444444444444444444444444444444444444444444444444444444444"
        }
      ],
      "approvalState": "approved",
      "contentHash": "f7ed607cc8286fb258eedf978ded7f8d99056138c871487cd1a97f704ac6e98c"
    }
  ],
  "bundleHash": "fb63cc07cbb73678f2b682db9ee543426575ed4c609aa64e796d4c1d49ab711e"
}
